[
  {
    "collection_status": "ok",
    "created_at": "2026-07-18T15:22:06+09:00",
    "domestic_market_date": "2026-07-18",
    "foreign_flow": null,
    "institution_flow": null,
    "kosdaq": {
      "change": -4.53,
      "change_unit": "pct",
      "direction": "down",
      "status": "ok",
      "value": 791.84
    },
    "kospi": {
      "change": -6.37,
      "change_unit": "pct",
      "direction": "down",
      "status": "ok",
      "value": 6820.6
    },
    "krw_usd": {
      "change": 8.61,
      "change_unit": "delta",
      "direction": "up",
      "status": "ok",
      "value": 1487.46
    },
    "nasdaq": {
      "change": -1.4,
      "change_unit": "pct",
      "direction": "down",
      "status": "ok",
      "value": 25520.24
    },
    "observed_at": "2026-07-18",
    "oil": {
      "change": 4.48,
      "change_unit": "pct",
      "direction": "up",
      "status": "ok",
      "value": 82.49
    },
    "snapshot_id": "2026-07-18-snapshot",
    "snapshot_version": 1,
    "source_references": [
      "FinanceDataReader"
    ],
    "sp500": {
      "change": -1.01,
      "change_unit": "pct",
      "direction": "down",
      "status": "ok",
      "value": 7457.69
    },
    "treasury_10y": {
      "change": -0.03,
      "change_unit": "delta",
      "direction": "down",
      "status": "ok",
      "value": 4.54
    },
    "updated_at": "2026-07-18T15:22:06+09:00",
    "us_market_date": null,
    "vix": {
      "change": 12.19,
      "change_unit": "pct",
      "direction": "up",
      "status": "ok",
      "value": 18.77
    }
  },
  {
    "collection_status": "ok",
    "created_at": "2026-07-19T22:06:35+09:00",
    "domestic_market_date": "2026-07-19",
    "foreign_flow": null,
    "institution_flow": null,
    "kosdaq": {
      "change": -4.53,
      "change_unit": "pct",
      "direction": "down",
      "status": "ok",
      "value": 791.84
    },
    "kospi": {
      "change": -6.37,
      "change_unit": "pct",
      "direction": "down",
      "status": "ok",
      "value": 6820.6
    },
    "krw_usd": {
      "change": 8.61,
      "change_unit": "delta",
      "direction": "up",
      "status": "ok",
      "value": 1487.46
    },
    "nasdaq": {
      "change": -1.4,
      "change_unit": "pct",
      "direction": "down",
      "status": "ok",
      "value": 25520.24
    },
    "observed_at": "2026-07-19",
    "oil": {
      "change": 3.58,
      "change_unit": "pct",
      "direction": "up",
      "status": "ok",
      "value": 81.78
    },
    "snapshot_id": "2026-07-19-snapshot",
    "snapshot_version": 1,
    "source_references": [
      "FinanceDataReader"
    ],
    "sp500": {
      "change": -1.01,
      "change_unit": "pct",
      "direction": "down",
      "status": "ok",
      "value": 7457.69
    },
    "treasury_10y": {
      "change": -0.03,
      "change_unit": "delta",
      "direction": "down",
      "status": "ok",
      "value": 4.54
    },
    "updated_at": "2026-07-19T22:06:35+09:00",
    "us_market_date": null,
    "vix": {
      "change": 12.19,
      "change_unit": "pct",
      "direction": "up",
      "status": "ok",
      "value": 18.77
    }
  },
  {
    "collection_status": "ok",
    "created_at": "2026-07-20T06:43:48+09:00",
    "domestic_market_date": "2026-07-20",
    "foreign_flow": null,
    "institution_flow": null,
    "kosdaq": {
      "change": -4.53,
      "change_unit": "pct",
      "direction": "down",
      "status": "ok",
      "value": 791.84
    },
    "kospi": {
      "change": -6.37,
      "change_unit": "pct",
      "direction": "down",
      "status": "ok",
      "value": 6820.6
    },
    "krw_usd": {
      "change": 7.68,
      "change_unit": "delta",
      "direction": "up",
      "status": "ok",
      "value": 1486.53
    },
    "nasdaq": {
      "change": -1.4,
      "change_unit": "pct",
      "direction": "down",
      "status": "ok",
      "value": 25520.24
    },
    "observed_at": "2026-07-20",
    "oil": {
      "change": 3.58,
      "change_unit": "pct",
      "direction": "up",
      "status": "ok",
      "value": 81.78
    },
    "snapshot_id": "2026-07-20-snapshot",
    "snapshot_version": 1,
    "source_references": [
      "FinanceDataReader"
    ],
    "sp500": {
      "change": -1.01,
      "change_unit": "pct",
      "direction": "down",
      "status": "ok",
      "value": 7457.69
    },
    "treasury_10y": {
      "change": -0.03,
      "change_unit": "delta",
      "direction": "down",
      "status": "ok",
      "value": 4.54
    },
    "updated_at": "2026-07-20T06:43:48+09:00",
    "us_market_date": null,
    "vix": {
      "change": 12.19,
      "change_unit": "pct",
      "direction": "up",
      "status": "ok",
      "value": 18.77
    }
  },
  {
    "collection_status": "ok",
    "created_at": "2026-07-21T06:43:25+09:00",
    "domestic_market_date": "2026-07-21",
    "foreign_flow": null,
    "institution_flow": null,
    "kosdaq": {
      "change": -5.33,
      "change_unit": "pct",
      "direction": "down",
      "status": "ok",
      "value": 749.64
    },
    "kospi": {
      "change": -4.46,
      "change_unit": "pct",
      "direction": "down",
      "status": "ok",
      "value": 6516.27
    },
    "krw_usd": {
      "change": -11.87,
      "change_unit": "delta",
      "direction": "down",
      "status": "ok",
      "value": 1475.52
    },
    "nasdaq": {
      "change": -0.05,
      "change_unit": "pct",
      "direction": "down",
      "status": "ok",
      "value": 25508.07
    },
    "observed_at": "2026-07-21",
    "oil": {
      "change": -0.08,
      "change_unit": "pct",
      "direction": "down",
      "status": "ok",
      "value": 82.42
    },
    "snapshot_id": "2026-07-21-snapshot",
    "snapshot_version": 1,
    "source_references": [
      "FinanceDataReader"
    ],
    "sp500": {
      "change": -0.19,
      "change_unit": "pct",
      "direction": "down",
      "status": "ok",
      "value": 7443.28
    },
    "treasury_10y": {
      "change": 0.06,
      "change_unit": "delta",
      "direction": "up",
      "status": "ok",
      "value": 4.6
    },
    "updated_at": "2026-07-21T06:43:25+09:00",
    "us_market_date": null,
    "vix": {
      "change": -0.64,
      "change_unit": "pct",
      "direction": "down",
      "status": "ok",
      "value": 18.65
    }
  },
  {
    "collection_status": "ok",
    "created_at": "2026-07-22T06:43:54+09:00",
    "domestic_market_date": "2026-07-22",
    "foreign_flow": null,
    "institution_flow": null,
    "kosdaq": {
      "change": 0.49,
      "change_unit": "pct",
      "direction": "up",
      "status": "ok",
      "value": 753.34
    },
    "kospi": {
      "change": 3.56,
      "change_unit": "pct",
      "direction": "up",
      "status": "ok",
      "value": 6747.95
    },
    "krw_usd": {
      "change": 4.66,
      "change_unit": "delta",
      "direction": "up",
      "status": "ok",
      "value": 1479.67
    },
    "nasdaq": {
      "change": 1.29,
      "change_unit": "pct",
      "direction": "up",
      "status": "ok",
      "value": 25837.21
    },
    "observed_at": "2026-07-22",
    "oil": {
      "change": 1.57,
      "change_unit": "pct",
      "direction": "up",
      "status": "ok",
      "value": 84.54
    },
    "snapshot_id": "2026-07-22-snapshot",
    "snapshot_version": 1,
    "source_references": [
      "FinanceDataReader"
    ],
    "sp500": {
      "change": 0.89,
      "change_unit": "pct",
      "direction": "up",
      "status": "ok",
      "value": 7509.2
    },
    "treasury_10y": {
      "change": 0.03,
      "change_unit": "delta",
      "direction": "up",
      "status": "ok",
      "value": 4.63
    },
    "updated_at": "2026-07-22T06:43:54+09:00",
    "us_market_date": null,
    "vix": {
      "change": -8.58,
      "change_unit": "pct",
      "direction": "down",
      "status": "ok",
      "value": 17.05
    }
  },
  {
    "collection_status": "ok",
    "created_at": "2026-07-23T06:43:32+09:00",
    "domestic_market_date": "2026-07-23",
    "foreign_flow": null,
    "institution_flow": null,
    "kosdaq": {
      "change": -0.3,
      "change_unit": "pct",
      "direction": "down",
      "status": "ok",
      "value": 751.09
    },
    "kospi": {
      "change": 0.74,
      "change_unit": "pct",
      "direction": "up",
      "status": "ok",
      "value": 6797.7
    },
    "krw_usd": {
      "change": -3.1,
      "change_unit": "delta",
      "direction": "down",
      "status": "ok",
      "value": 1476.62
    },
    "nasdaq": {
      "change": -0.57,
      "change_unit": "pct",
      "direction": "down",
      "status": "ok",
      "value": 25690.9
    },
    "observed_at": "2026-07-23",
    "oil": {
      "change": 1.85,
      "change_unit": "pct",
      "direction": "up",
      "status": "ok",
      "value": 86.48
    },
    "snapshot_id": "2026-07-23-snapshot",
    "snapshot_version": 1,
    "source_references": [
      "FinanceDataReader"
    ],
    "sp500": {
      "change": -0.14,
      "change_unit": "pct",
      "direction": "down",
      "status": "ok",
      "value": 7498.96
    },
    "treasury_10y": {
      "change": 0.03,
      "change_unit": "delta",
      "direction": "up",
      "status": "ok",
      "value": 4.66
    },
    "updated_at": "2026-07-23T06:43:32+09:00",
    "us_market_date": null,
    "vix": {
      "change": -2.4,
      "change_unit": "pct",
      "direction": "down",
      "status": "ok",
      "value": 16.64
    }
  },
  {
    "collection_status": "ok",
    "created_at": "2026-07-24T06:44:34+09:00",
    "domestic_market_date": "2026-07-24",
    "foreign_flow": null,
    "institution_flow": null,
    "kosdaq": {
      "change": 5.22,
      "change_unit": "pct",
      "direction": "up",
      "status": "ok",
      "value": 790.28
    },
    "kospi": {
      "change": 4.4,
      "change_unit": "pct",
      "direction": "up",
      "status": "ok",
      "value": 7096.89
    },
    "krw_usd": {
      "change": -1.51,
      "change_unit": "delta",